{
  "schemaVersion": 2,
  "kind": "ci-candidate",
  "deployable": false,
  "candidateId": "candidate-1111111111111111111111111111111111111111-200-1",
  "repository": "greggorio/abaronesa-emporio",
  "commitSha": "1111111111111111111111111111111111111111",
  "ref": "refs/heads/main",
  "createdAt": "2026-07-29T12:00:00Z",
  "workflow": {"runId":"200","attempt":1,"url":"https://github.com/greggorio/abaronesa-emporio/actions/runs/200"},
  "sourceCi": {"runId":"100","attempt":1,"baseCommitSha":"0000000000000000000000000000000000000000","planSha256":"sha256:aaaaaaaaaaaaaaaaaaaaaaaaaaaaaaaaaaaaaaaaaaaaaaaaaaaaaaaaaaaaaaaa"},
  "catalog": {"schemaVersion":1,"sha256":"sha256:b73f3d1b754f0830653890ed572e4e4a14c9e3018206e3c798564b978a115771"},
  "predecessor": {"status":"first","candidateId":null,"commitSha":null,"workflowRunId":null,"artifactId":null,"artifactDigest":null},
  "resolution": {"classification":"first_release","changedPaths":[],"directComponents":["backend","website_back","frontend","website_front","whatsapp_service","gateway"],"buildComponents":["backend","website_back","frontend","website_front","whatsapp_service","gateway"],"validationComponents":["backend","website_back","frontend","website_front","whatsapp_service","gateway"],"inheritedComponents":[],"warnings":["FIRST_RELEASE_REQUIRES_COMPLETE_BOM"]},
  "components": [
    {"id":"backend","imageRepository":"ghcr.io/greggorio/abaronesa-emporio-backend","tag":"ghcr.io/greggorio/abaronesa-emporio-backend:sha-1111111111111111111111111111111111111111","digest":"sha256:0000000000000000000000000000000000000000000000000000000000000001","immutableRef":"ghcr.io/greggorio/abaronesa-emporio-backend@sha256:0000000000000000000000000000000000000000000000000000000000000001","commitSha":"1111111111111111111111111111111111111111","workflowRunId":"200","workflowAttempt":1,"builtAt":"2026-07-29T12:00:00Z","state":"built","originCandidateId":null,"labels":{"org.opencontainers.image.source":"https://github.com/greggorio/abaronesa-emporio","org.opencontainers.image.revision":"1111111111111111111111111111111111111111","org.opencontainers.image.version":"candidate-1111111111111111111111111111111111111111-200-1","org.opencontainers.image.created":"2026-07-29T12:00:00Z"},"checks":{"build":"passed","test":"passed","scan":"passed"}},
    {"id":"website_back","imageRepository":"ghcr.io/greggorio/abaronesa-emporio-website-backend","tag":"ghcr.io/greggorio/abaronesa-emporio-website-backend:sha-1111111111111111111111111111111111111111","digest":"sha256:0000000000000000000000000000000000000000000000000000000000000002","immutableRef":"ghcr.io/greggorio/abaronesa-emporio-website-backend@sha256:0000000000000000000000000000000000000000000000000000000000000002","commitSha":"1111111111111111111111111111111111111111","workflowRunId":"200","workflowAttempt":1,"builtAt":"2026-07-29T12:00:00Z","state":"built","originCandidateId":null,"labels":{"org.opencontainers.image.source":"https://github.com/greggorio/abaronesa-emporio","org.opencontainers.image.revision":"1111111111111111111111111111111111111111","org.opencontainers.image.version":"candidate-1111111111111111111111111111111111111111-200-1","org.opencontainers.image.created":"2026-07-29T12:00:00Z"},"checks":{"build":"passed","test":"passed","scan":"passed"}},
    {"id":"frontend","imageRepository":"ghcr.io/greggorio/abaronesa-emporio-frontend","tag":"ghcr.io/greggorio/abaronesa-emporio-frontend:sha-1111111111111111111111111111111111111111","digest":"sha256:0000000000000000000000000000000000000000000000000000000000000003","immutableRef":"ghcr.io/greggorio/abaronesa-emporio-frontend@sha256:0000000000000000000000000000000000000000000000000000000000000003","commitSha":"1111111111111111111111111111111111111111","workflowRunId":"200","workflowAttempt":1,"builtAt":"2026-07-29T12:00:00Z","state":"built","originCandidateId":null,"labels":{"org.opencontainers.image.source":"https://github.com/greggorio/abaronesa-emporio","org.opencontainers.image.revision":"1111111111111111111111111111111111111111","org.opencontainers.image.version":"candidate-1111111111111111111111111111111111111111-200-1","org.opencontainers.image.created":"2026-07-29T12:00:00Z"},"checks":{"build":"passed","test":"passed","scan":"passed"}},
    {"id":"website_front","imageRepository":"ghcr.io/greggorio/abaronesa-emporio-website-frontend","tag":"ghcr.io/greggorio/abaronesa-emporio-website-frontend:sha-1111111111111111111111111111111111111111","digest":"sha256:0000000000000000000000000000000000000000000000000000000000000004","immutableRef":"ghcr.io/greggorio/abaronesa-emporio-website-frontend@sha256:0000000000000000000000000000000000000000000000000000000000000004","commitSha":"1111111111111111111111111111111111111111","workflowRunId":"200","workflowAttempt":1,"builtAt":"2026-07-29T12:00:00Z","state":"built","originCandidateId":null,"labels":{"org.opencontainers.image.source":"https://github.com/greggorio/abaronesa-emporio","org.opencontainers.image.revision":"1111111111111111111111111111111111111111","org.opencontainers.image.version":"candidate-1111111111111111111111111111111111111111-200-1","org.opencontainers.image.created":"2026-07-29T12:00:00Z"},"checks":{"build":"passed","test":"passed","scan":"passed"}},
    {"id":"whatsapp_service","imageRepository":"ghcr.io/greggorio/abaronesa-emporio-whatsapp-service","tag":"ghcr.io/greggorio/abaronesa-emporio-whatsapp-service:sha-1111111111111111111111111111111111111111","digest":"sha256:0000000000000000000000000000000000000000000000000000000000000005","immutableRef":"ghcr.io/greggorio/abaronesa-emporio-whatsapp-service@sha256:0000000000000000000000000000000000000000000000000000000000000005","commitSha":"1111111111111111111111111111111111111111","workflowRunId":"200","workflowAttempt":1,"builtAt":"2026-07-29T12:00:00Z","state":"built","originCandidateId":null,"labels":{"org.opencontainers.image.source":"https://github.com/greggorio/abaronesa-emporio","org.opencontainers.image.revision":"1111111111111111111111111111111111111111","org.opencontainers.image.version":"candidate-1111111111111111111111111111111111111111-200-1","org.opencontainers.image.created":"2026-07-29T12:00:00Z"},"checks":{"build":"passed","test":"passed","scan":"passed"}},
    {"id":"gateway","imageRepository":"ghcr.io/greggorio/abaronesa-emporio-gateway","tag":"ghcr.io/greggorio/abaronesa-emporio-gateway:sha-1111111111111111111111111111111111111111","digest":"sha256:0000000000000000000000000000000000000000000000000000000000000006","immutableRef":"ghcr.io/greggorio/abaronesa-emporio-gateway@sha256:0000000000000000000000000000000000000000000000000000000000000006","commitSha":"1111111111111111111111111111111111111111","workflowRunId":"200","workflowAttempt":1,"builtAt":"2026-07-29T12:00:00Z","state":"built","originCandidateId":null,"labels":{"org.opencontainers.image.source":"https://github.com/greggorio/abaronesa-emporio","org.opencontainers.image.revision":"1111111111111111111111111111111111111111","org.opencontainers.image.version":"candidate-1111111111111111111111111111111111111111-200-1","org.opencontainers.image.created":"2026-07-29T12:00:00Z"},"checks":{"build":"passed","test":"passed","scan":"passed"}}
  ],
  "integration": {
    "workflowRunId":"200","workflowAttempt":1,"pendingSha256":"sha256:bbbbbbbbbbbbbbbbbbbbbbbbbbbbbbbbbbbbbbbbbbbbbbbbbbbbbbbbbbbbbbbb","receiptSha256":"sha256:cccccccccccccccccccccccccccccccccccccccccccccccccccccccccccccccc","checkedAt":"2026-07-29T12:20:00Z","status":"passed",
    "services":[{"id":"postgresql","state":"running","health":"healthy"},{"id":"backend","state":"running","health":"healthy"},{"id":"website_back","state":"running","health":"healthy"},{"id":"frontend","state":"running","health":"healthy"},{"id":"website_front","state":"running","health":"healthy"},{"id":"whatsapp_service","state":"running","health":"healthy"},{"id":"gateway","state":"running","health":"healthy"}],
    "probes":[{"id":"website_root","status":"passed"},{"id":"erp_root","status":"passed"},{"id":"website_theme_api","status":"passed"},{"id":"erp_login","status":"passed"},{"id":"erp_whatsapp_api","status":"passed"},{"id":"publisher_route_absent","status":"passed"},{"id":"deployer_route_absent","status":"passed"},{"id":"unknown_host_denied","status":"passed"},{"id":"whatsapp_internal","status":"passed"}],
    "cleanup":{"containers":0,"volumes":0,"networks":0,"imagesAbsent":6}
  }
}
